term_ID,description,frequency,plot_X,plot_Y,plot_size,value,uniqueness,dispensability,representative,eliminated
GO:0016360,sensory organ precursor cell fate determination,0.00%,5.275,-2.902,2.134,19.0414,0.37,0,16360,0
GO:0043044,ATP-dependent chromatin remodeling,0.05%,2.82,5.653,3.77,16.9996,0.777,0.017,43044,0
GO:0000209,protein polyubiquitination,0.07%,-3.129,5.731,3.929,8.5737,0.853,0.022,209,0
GO:0045747,positive regulation of Notch signaling pathway,0.01%,-4.462,-1.868,3.241,17.4364,0.724,0.04,45747,0
GO:0008285,negative regulation of cell proliferation,0.13%,-2.417,-5.69,4.214,12.72,0.743,0.174,8285,0
GO:0042742,defense response to bacterium,0.10%,-5.194,1.154,4.097,5.3525,0.886,0.233,42742,0
